{
  "$id": "integrations.emailProvider",
  "name": "Email Provider",
  "version": "0.11.0",
  "status": "stable",
  "domain": "integrations",
  "type": "connector",
  "providerKey": "generic-email",
  "family": "email",
  "description": "Generic transactional email provider connector for approved NEXT F workflows.",
  "ownership": "customer",
  "runtimeModes": [
    "nextf-server",
    "provider-api"
  ],
  "capabilities": [
    "message.send",
    "account.verify"
  ],
  "authentication": {
    "type": "configurable",
    "supported": [
      "api-key",
      "oauth2",
      "provider-managed"
    ]
  },
  "configurationFields": [
    {
      "key": "providerKey",
      "label": "Provider Adapter Key",
      "primitive": "fields.text",
      "required": true,
      "publicClientEligible": false,
      "secret": false,
      "customerEditable": true,
      "helpText": "Provider Adapter Key",
      "validation": {}
    },
    {
      "key": "senderEmail",
      "label": "Sender Email",
      "primitive": "fields.email",
      "required": true,
      "publicClientEligible": false,
      "secret": false,
      "customerEditable": true,
      "helpText": "Sender Email",
      "validation": {}
    },
    {
      "key": "senderName",
      "label": "Sender Name",
      "primitive": "fields.text",
      "required": true,
      "publicClientEligible": false,
      "secret": false,
      "customerEditable": true,
      "helpText": "Sender Name",
      "validation": {}
    },
    {
      "key": "credentialRef",
      "label": "Credential Reference",
      "primitive": "fields.text",
      "required": true,
      "publicClientEligible": false,
      "secret": true,
      "customerEditable": false,
      "helpText": "Credential Reference",
      "validation": {}
    },
    {
      "key": "replyToEmail",
      "label": "Reply-To Email",
      "primitive": "fields.email",
      "required": false,
      "publicClientEligible": false,
      "secret": false,
      "customerEditable": true,
      "helpText": "Reply-To Email",
      "validation": {}
    }
  ],
  "consent": {
    "categories": [],
    "mode": "purpose-dependent"
  },
  "dataHandling": {
    "minimize": true,
    "secretsServerSide": true,
    "rawPayloadForwarding": false
  },
  "health": {
    "supportsConnectionTest": true,
    "supportsHealthSnapshot": true
  },
  "actions": [],
  "mappings": [],
  "futureBindings": {
    "events": "phase-13",
    "webhooks": "phase-14",
    "permissions": "phase-15",
    "siteManifest": "phase-16",
    "api": "phase-18"
  },
  "notes": [
    "Transactional form notifications do not automatically imply marketing consent."
  ],
  "aliases": [
    "Email",
    "Transactional Email"
  ]
}
